title,author,score,posted_at,link
"/r/WorldNews Live Thread: Russian Invasion of Ukraine Day 1377, Part 1 (Thread #1524)",WorldNewsMods,145,2025-12-02T04:02:27+00:00,https://www.reddit.com/live/18hnzysb1elcs
Russia Starts Issuing Draft Notices at Airports to New Citizens and Returning Expats,LetsGoBrandon4256,6290,2025-12-02T02:06:02+00:00,https://united24media.com/latest-news/russia-starts-issuing-draft-notices-at-airports-to-new-citizens-and-returning-expats-13919
Canadian air passenger traffic to U.S. down for 9th consecutive month,Immediate-Link490,8011,2025-12-01T20:20:01+00:00,https://globalnews.ca/news/11554355/canada-us-air-travel-ninth-straight-drop/
A man has unexpectedly been cured of HIV after receiving a transplant of non-HIV resistant stem cells,New_Scientist_Mag,14380,2025-12-01T16:11:43+00:00,https://www.newscientist.com/article/2506595-man-unexpectedly-cured-of-hiv-after-stem-cell-transplant/
Canada clinches deal to join Europe’s €150B defense scheme,OkFix4074,5120,2025-12-01T19:01:24+00:00,https://www.politico.eu/article/canada-clinches-deal-to-join-europes-e150b-defense-scheme/
Pope Leo Tells Students 'Don't Ask AI to Do Your Homework' During Virtual Appearance at Youth Conference,ubcstaffer123,2472,2025-12-01T21:45:55+00:00,https://people.com/pope-leo-tells-students-not-to-ask-ai-to-do-homework-11857450
Putin says Russia has taken control of 2 Ukrainian cities. Ukraine denies claims,MRADEL90,1070,2025-12-02T01:16:59+00:00,https://abcnews.go.com/International/putin-russia-control-2-ukrainian-cities-ukraine-denies/story?id=128018937
Dignitas founder dies by assisted suicide aged 92,iwantUineedUohBBohBB,956,2025-12-02T01:29:17+00:00,https://news.sky.com/story/dignitas-founder-dies-by-assisted-suicide-aged-92-13477727
EU tells Trump: You can’t pardon Putin for war crimes in Ukraine,HydrolicKrane,25555,2025-12-01T10:28:07+00:00,https://www.politico.eu/article/donald-trump-vladimir-putin-war-crimes-volodymyr-zelenskyy-ukraine/
It's time to consider the switch to open-source BI. You won't look back.,presetio,,,https://alb.reddit.com/cr?za=7FaHE3ehF63tuotTtQh7bnx8g7gu4aYEwCQU_d1coz9kleJ1NLe675A3Bxy8vOLup-LshlYutOgEDwIq_dwLF4BKYjj4wc4dgTUQItnppn_LCA4YR1Rfvh0640M-L5zu6vJQZ0TztaBwPkwO0_HsRWgmnxUcPrZf0T8Tb04Zos8W7dyL2y4HWQc9Zk-VHHcCjfedzqkcaSEwgZq6aT3HF9pr8hBeGEfVLORIz8AUJa7Ff9L5sdEBRakq9q3UROwd4nsIVPhnW3the2lsFnLXNlt_5qviU8Exkfux3-wO9S8aiBnXZFO1l5t4OspAvDhEjm91TVBAw0MULz6-UvdBWYZ136tViU-ZkcbAIrdFMVuYn74hMtCVUncms3sb-DotD8w1npVHH_iZ17m-v4a2lhrDreT76GLuqAwVlxKfx5nDJfAHKOe0mZYXxPhWJeEAh0SoZxCsxJblE_n0LruGy2gPhaJ-t4oMnySYGUmzfXVNslPa97vJlPpWxlo_5lkMH7Z9uwX6k2yDJrVWWjrLA3HvbKNG363xYuGV45Iw3hBQLqVLmln1pNTMAPO8DN77X3inpqqACjZbYSzjXF8CDROo-YUszwAaypKwIOaVxUA1fx2F9isbt33lBPFUvx9SstM9mGpaRz0&zp=lVEdhCzexyr8BuiZQbuL3isyJATfkKK_kppOk5VWX5qrZL7cjoDShGMyJFg3WDbyNnR2THWRqUKuSDFFuPs-pMrU2BuoK4KPwoiuD2MK5vzYhUrmzsj_upg_8dWXEcF-JdbWZQ8Tg7dJHFZVI8YYAcDjPTLpK_T9U9Ol912KwOpXdd55cjMstGx1tFsmAel09Cmq35Yng2caFLmTNH-rVpTjkCCv6DXooJm7UXPR3yQjze86u4qqka4Te2bEZDpMA54ZczUXhbqF0J-P4rRRo3W3hCRooxw9Tn63VejPqjyb
,Street_Anon,1130,2025-12-01T23:23:57+00:00,https://www.theglobeandmail.com/politics/article-canada-eu-military-procurement-fund-defence-spending/
"NATO may get 'more aggressive' in countering Russia’s hybrid attacks, top military official says",AdSpecialist6598,3947,2025-12-01T14:43:10+00:00,https://kyivindependent.com/nato-may-get-more-aggressive-in-countering-russias-hybrid-attacks-top-military-official-tells-ft/
Trump reportedly gave Maduro ultimatum to relinquish power in Venezuela,Brennenstein,4986,2025-12-01T12:51:22+00:00,https://www.theguardian.com/world/2025/dec/01/trump-maduro-ultimatum-relinquish-power-venezuela
,bloomberg,2544,2025-12-01T15:43:47+00:00,https://www.bloomberg.com/news/articles/2025-12-01/oil-tanker-mersin-suffered-explosions-off-senegal-manager-says
"South Korea police say 120,000 home cameras hacked for 'sexploitation' footage",WhyohTee,432,2025-12-02T00:47:59+00:00,https://www.bbc.com/news/articles/cj01q6p7ndlo
Top Russian banker says the EU faces 50 years of litigation if it takes Russia's frozen assets,Raj_Valiant3011,1389,2025-12-01T18:08:37+00:00,https://www.reuters.com/business/finance/top-russian-banker-says-eu-faces-50-years-litigation-if-it-takes-russias-frozen-2025-12-01/
Son of senior Hamas official Ghazi Hamad killed fleeing Rafah tunnel - report,barsik_,539,2025-12-01T22:25:05+00:00,https://www.jpost.com/israel-news/defense-news/article-876853
Ukraine’s interceptor drone downs Russia’s jet-propelled Shahed UAV in historic first,juniper_nest,6902,2025-12-01T08:48:53+00:00,https://euromaidanpress.com/2025/12/01/ukraines-interceptor-drone-downs-russias-jet-propelled-shahed-uav-in-historic-first/
"New Mass Effect Tali’Zorah 1/6 Scale Statue limited to 1,000 units. Save $20 when you pre-order before November 14th!",DarkHorseDirect,,,https://alb.reddit.com/cr?za=6UKcaKpSxr1QrIpq_wtfsArRbrZCWYRgHKihNhMowe4pEw0KEwsERmRiSrw-4OUUv8FH2_RFonltrotQ3LEXn3BVvX19hWHDsSHWYzvwUX1LyT2IyC5VGrcDPCQGn3nII_bnW0M-zxVnl-QvDneaEPxnZSm4dckXlrebBJotEGo6mfaMN4SfpQ3CEBIguSk3cDpHhYeyJkf6KvpsOJJY5XaCIrphk_u8vMMXBjhmezbfUwWds3dcz4tGXnIZ3qaXef5v8ApApNa8MDPmu2BqkeMwOLTnu_R_P_uR5DfW8zTrzrUmbrRqF6zPNvY7NSc4Idgk4_CMkIIgS261PjFhiQk3Yuaf1GuzAEf9GLiDF3WXWV-BVlT9a9mXkM5xf864HzcNRIpU26SM8MBcrMdFHmuQRlor1MvuuWfaOY7JXlbPW6iwM40cXFxLjmTOfSeYdzXFAINC8TDtFDuVvUMrZNP8aRmFhit8lO1aj8j-IgCHjH7sfbtMPOdMW3pBZNseyT8j_d0Cgg3MZwLYn1Bejsf1rM4rZpXCa9MRniKf2wgD4iUBU-junUf--bhYXqw5Znd6niX_yPigKEAfLcPBxP2gUrEDpM9bQVnyzifxEkeoAmjJNmjKti69iqTyo-bIoT3y9Ob1GA&zp=UzMMfUwJ1ZbT4ybI9aFe8fTJehvjGFzD50WE-zLniA5lidFrTHdGDg1axzkkwM9K0TI4gtltq2cOZFWaS3wijFx4Ci9SkJ5qrZO3tjBAJKtsBMOIA3owSNwPK7daicn147CFdYfj_VkH9kRII0futi4EX4gCzm1PVMBJiEIEDDH9xHNFKGAwOCxabQC5ui4URtG3ItlCMbMSZMz30txl3CyF_7lAS4OjWeS643zDXZjZta4m6oKFhqQXSxHk3tVu5okALAyct9eB_XDwnR_1MKWlQq46oLoThuuwj42kUkAqtbuzC4uTM42xuKBujYa5H3WNgqodL_0yY8obQA
"Trump to hold Venezuela Oval Office meeting, sources say",_cyberbabyangel_,1710,2025-12-01T15:21:32+00:00,https://www.cnn.com/2025/12/01/politics/trump-venezuela-meeting
"F-16 ammunition, air defenses — Netherlands announces $290 million Ukraine aid package",Brennenstein,2707,2025-12-01T12:19:43+00:00,https://kyivindependent.com/f-16-ammunition-air-defenses-netherlands-announces-290-million-ukraine-aid-package/
"Hong Kong highrise netting did not meet code, officials say, with death toll at 151 people",esporx,183,2025-12-02T02:26:10+00:00,https://www.cbc.ca/news/world/hong-kong-wang-fuk-fire-monday-9.6998363
"Hong Kong authorities say netting on buildings that caught fire, killing 151, did not meet code",yahoonews,3897,2025-12-01T09:44:54+00:00,https://uk.news.yahoo.com/donations-hong-kong-fire-victims-075627750.html
US envoy to meet Putin in Moscow - as NATO could consider 'pre-emptive strike',ChiefFun,244,2025-12-01T22:46:03+00:00,https://news.sky.com/story/us-envoy-to-meet-putin-in-moscow-as-nato-could-consider-pre-emptive-strike-13478095
Zelenskyy says US peace plan ‘looks better’ with revisions but work continues,AndroidOne1,541,2025-12-01T17:34:33+00:00,https://apnews.com/article/zelenskyy-paris-macron-russia-ukraine-war-704d68a36c36495f6dada056b729fac3
China cracks down on calls for accountability over deadly Hong Kong blaze,Physical-Tackle4365,68,2025-12-02T04:48:44+00:00,https://www.aljazeera.com/news/2025/12/1/china-quashes-calls-for-accountability-over-deadly-hong-kong-blaze
Dutch soldiers to take charge of Patriot air defence in Poland,PostDeletedByReddit,1008,2025-12-01T14:08:07+00:00,https://www.dutchnews.nl/2025/12/dutch-soldiers-to-take-charge-of-patriot-air-defence-in-poland/
China cracks down on calls for accountability over deadly Hong Kong blaze,Physical-Tackle4365,69,2025-12-02T04:48:44+00:00,https://www.aljazeera.com/news/2025/12/1/china-quashes-calls-for-accountability-over-deadly-hong-kong-blaze
"Thousands in Philippines protest corruption, demand return of stolen funds",ZeroEqualsOne,251,2025-12-01T21:27:54+00:00,https://www.npr.org/2025/11/30/nx-s1-5626219/philippines-protest-corruption-stolen-funds
Russia Faces Fast Growing South Korean K9 Artillery Arsenal on its NATO Borders as Estonia Receives New Shipment,snowfordessert,1399,2025-12-01T12:07:44+00:00,https://militarywatchmagazine.com/article/russia-growing-skorean-k9-borders
WHO warning over shortage of obesity jabs,OneNormalBloke,685,2025-12-01T15:20:52+00:00,https://www.bbc.co.uk/news/articles/cze8n0753zzo
"WW1 toxic compound sprayed on Georgian protesters, BBC evidence suggests",Whatever-you-bastard,9732,2025-12-01T01:46:52+00:00,https://www.bbc.com/news/articles/czrk7g50e1po
"12 dead, dozens missing as landslide submerges boats in Peru port",Cybertronian1512,76,2025-12-02T02:57:13+00:00,https://www.thehindu.com/news/international/people-dead-and-missing-as-landslide-submerges-boats-in-peru-port/article70347219.ece
Zelenskyy Meets Macron in Paris to Discuss Peace Plan and Security Guarantees,EsperaDeus,369,2025-12-01T17:57:26+00:00,https://united24media.com/latest-news/zelenskyy-meets-macron-in-paris-to-discuss-peace-plan-and-security-guarantees-13918
"Congo declares its latest Ebola outbreak over, after 43 deaths",Donners22,180,2025-12-01T21:53:25+00:00,https://apnews.com/article/congo-ebola-outbreak-update-minister-2fdefab2c0f004955e7f8e30029fa471
'Joke Of Aid Diplomacy': Colombo Angered After Pakistan Sends Expired Relief Supplies,GiveMeSomeSunshine3,,2025-12-02T06:17:11+00:00,https://www.news18.com/world/joke-of-aid-diplomacy-colombo-angered-after-pakistan-sends-expired-relief-supplies-exclusive-ws-kl-9743871.html
"Israel set to fully deploy 'game-changing, cutting-edge' Iron Beam laser system this month",barsik_,693,2025-12-01T13:32:37+00:00,https://www.jpost.com/israel-news/defense-news/article-876798
India and China trade barbs after passenger detained at Shanghai airport,Known_Week_158,38,2025-12-02T04:48:56+00:00,https://www.bbc.com/news/articles/c8e9kz127w0o
Rubio Calls German Counterpart as Merz Rejects ‘Dictated Peace’ for Ukraine,jackytheblade,,2025-12-02T06:17:42+00:00,https://www.kyivpost.com/post/65360
Venezuela calls on OPEC to counter US threats,juniper_nest,2408,2025-12-01T05:11:57+00:00,https://www.aljazeera.com/news/2025/12/1/venezuela-calls-on-opec-to-counter-us-threats
"Philippines eyes acquiring most advanced South Korea fighter jet, KF-21",snowfordessert,122,2025-12-01T20:58:55+00:00,https://www.philstar.com/headlines/2025/12/01/2491080/philippines-eyes-acquiring-most-advanced-south-korea-fighter-jet
Zelenskyy arrives in Paris for talks with Macron as US-led peace talks advance,perplexed-redditor,493,2025-12-01T12:42:31+00:00,https://www.euronews.com/2025/12/01/zelenskyy-arrives-in-paris-for-talks-with-macron-as-us-led-peace-talks-advance
"Thousands rally in Bulgaria against 2026 budget, clash with police",Silly-avocatoe,52,2025-12-02T00:40:25+00:00,https://www.reuters.com/world/thousands-rally-bulgaria-against-2026-budget-clash-with-police-2025-12-01/
"HIV infections in Argentina rise as state condom distribution drops, NGO warns",hernannadal,148,2025-12-01T18:08:23+00:00,https://buenosairesherald.com/society/hiv-infections-in-argentina-rise-as-state-condom-distribution-drops-ngo-warns
Zelensky: ‘Tough issues’ still have to be worked through,EsperaDeus,210,2025-12-01T16:17:49+00:00,https://thehill.com/policy/international/5627817-zelensky-ukraine-russia-peace-talks/
'Many options' on table for Venezuela as US mulls land attacks on drug traffickers,ChiefFun,60,2025-12-01T22:48:53+00:00,https://news.sky.com/story/many-options-on-table-for-venezuela-as-us-mulls-land-attacks-on-drug-traffickers-13478082
French mayor jailed in sex-tape blackmail case,LeMonde_en,260,2025-12-01T14:58:02+00:00,https://www.lemonde.fr/en/france/article/2025/12/01/french-mayor-jailed-in-sex-tape-blackmail-case_6748025_7.html
"After uproar, Dublin shelves plan to remove Chaim Herzog’s name from park",jewish_insider,195,2025-12-01T16:14:30+00:00,https://jewishinsider.com/2025/12/ireland-chaim-herzog-dublin-park-antisemitism-israel-boycott/
"Carney shuffles cabinet, brings back Trudeau-era minister Marc Miller",Immediate-Link490,87,2025-12-01T20:13:08+00:00,https://www.ctvnews.ca/politics/article/carney-to-shuffle-cabinet-after-guilbeault-resignation/
Fears of spying and interrogation as 'mega' Chinese embassy in London looks set for approval,StopTheGregSign,,2025-12-02T06:39:57+00:00,https://www.abc.net.au/news/2025-12-02/chinese-mega-embassy-in-london-sparks-major-espionage-fears/106085916?utm_source=abc_news_app&utm_medium=content_shared&utm_campaign=abc_news_app&utm_content=other
"Flooding in Indonesia, Thailand and Sri Lanka kills more than 1,160 people as recovery efforts continue",ZeroEqualsOne,72,2025-12-01T21:24:01+00:00,https://www.abc.net.au/news/2025-12-02/more-than-1000-dead-in-flooding-in-indonesia-thailand-sri-lanka/106089220
India said to pitch new arms deal with Russia during Putin visit,Physical-Tackle4365,117,2025-12-01T18:14:47+00:00,https://www.thehindubusinessline.com/news/world/india-said-to-pitch-new-arms-deal-with-russia-during-putin-visit/article70343951.ece
